{
  "version": "1.0",
  "updated_at": "2026-01-25T10:00:00Z",
  "developers": {
    "dev-a": {
      "id": "dev-a",
      "name": "Core Platform Engineer",
      "namespace": ["pkg/runner/", "pkg/platform/", "pkg/config/"],
      "current_task": "CORE-01",
      "completed_specs": ["CONF-01"],
      "worktree": "/tmp/.worktree/pr-a-CORE-01",
      "branch": "pr-a-CORE-01"
    },
    "dev-b": {
      "id": "dev-b",
      "name": "Security & Infra Engineer",
      "namespace": ["pkg/security/", "pkg/governance/", "pkg/observability/"],
      "current_task": null,
      "completed_specs": [],
      "worktree": null,
      "branch": null
    },
    "dev-c": {
      "id": "dev-c",
      "name": "AI & Skills Engineer",
      "namespace": ["pkg/skill/", "skills/", "pkg/mcp/"],
      "current_task": null,
      "completed_specs": ["SKILL-01"],
      "worktree": null,
      "branch": null
    }
  },
  "specs": {
    "CORE-01": {
      "id": "CORE-01",
      "name": "Runner Lifecycle",
      "status": "in_progress",
      "dependencies": ["CONF-01", "SKILL-01"],
      "assignee": "dev-a",
      "priority": "p0",
      "phase": "Phase 2",
      "started_at": "2026-01-25T10:00:00Z"
    },
    "CORE-02": {
      "id": "CORE-02",
      "name": "Context Chunking",
      "status": "ready",
      "dependencies": [],
      "assignee": null,
      "priority": "p0",
      "phase": "Phase 2"
    },
    "CONF-01": {
      "id": "CONF-01",
      "name": "Configuration",
      "status": "completed",
      "dependencies": [],
      "assignee": "dev-a",
      "priority": "p0",
      "phase": "Phase 1",
      "completed_at": "2026-01-24T10:00:00Z"
    },
    "SKILL-01": {
      "id": "SKILL-01",
      "name": "Skill Definition",
      "status": "completed",
      "dependencies": [],
      "assignee": "dev-c",
      "priority": "p0",
      "phase": "Phase 1",
      "completed_at": "2026-01-24T10:00:00Z"
    },
    "BLOCKED-01": {
      "id": "BLOCKED-01",
      "name": "Blocked Example",
      "status": "blocked",
      "dependencies": ["NONEXISTENT-01"],
      "assignee": null,
      "priority": "p1",
      "phase": "Phase 3"
    }
  },
  "locks": {
    "runner": {
      "locked_by": "dev-a",
      "locked_at": "2026-01-25T10:00:00Z",
      "spec_id": "CORE-01",
      "reason": "实现 Runner 生命周期",
      "expires_at": "2026-01-25T18:00:00Z"
    }
  },
  "worktrees": [
    {
      "spec_id": "CORE-01",
      "developer": "dev-a",
      "branch": "pr-a-CORE-01",
      "path": "/tmp/.worktree/pr-a-CORE-01",
      "created_at": "2026-01-25T10:00:00Z"
    }
  ],
  "milestones": {
    "M0": {
      "name": "项目启动",
      "status": "completed",
      "completed_at": "2026-01-20T00:00:00Z"
    },
    "M1": {
      "name": "基础就绪",
      "status": "pending",
      "completed_at": null
    }
  }
}
