{
  "version": "1.0",
  "updated_at": "2026-01-26T04:09:42Z",
  "developers": {
    "dev-a": {
      "id": "dev-a",
      "name": "Core Platform Engineer",
      "namespace": [
        "pkg/runner/",
        "pkg/platform/",
        "pkg/config/"
      ],
      "current_task": null,
      "completed_specs": [
        "PLAT-07",
        "CONF-01",
        "CORE-02"
      ],
      "worktree": null,
      "branch": null
    },
    "dev-b": {
      "id": "dev-b",
      "name": "Security & Infra Engineer",
      "namespace": [
        "pkg/security/",
        "pkg/governance/",
        "pkg/observability/"
      ],
      "current_task": null,
      "completed_specs": [
        "DIST-01",
        "GOV-01"
      ],
      "worktree": null,
      "branch": null
    },
    "dev-c": {
      "id": "dev-c",
      "name": "AI & Skills Engineer",
      "namespace": [
        "pkg/skill/",
        "skills/",
        "pkg/mcp/"
      ],
      "current_task": null,
      "completed_specs": [
        "SKILL-01",
        "LIB-01"
      ],
      "worktree": null,
      "branch": null
    }
  },
  "specs": {
    "PLAT-07": {
      "id": "PLAT-07",
      "name": "Project Structure",
      "status": "completed",
      "dependencies": [],
      "assignee": "dev-a",
      "priority": "p0",
      "phase": "Phase 0",
      "completed_at": "2026-01-25T00:00:00Z"
    },
    "DIST-01": {
      "id": "DIST-01",
      "name": "Distribution",
      "status": "completed",
      "dependencies": [],
      "assignee": "dev-b",
      "priority": "p0",
      "phase": "Phase 0",
      "completed_at": "2026-01-25T00:00:00Z"
    },
    "CONF-01": {
      "id": "CONF-01",
      "name": "Configuration",
      "status": "completed",
      "dependencies": [],
      "assignee": "dev-a",
      "priority": "p0",
      "phase": "Phase 1",
      "completed_at": "2026-01-25T00:00:00Z"
    },
    "SKILL-01": {
      "id": "SKILL-01",
      "name": "Skill Definition",
      "status": "completed",
      "dependencies": [],
      "assignee": "dev-c",
      "priority": "p0",
      "phase": "Phase 1",
      "completed_at": "2026-01-25T00:00:00Z"
    },
    "CONF-02": {
      "id": "CONF-02",
      "name": "Idempotency",
      "status": "ready",
      "dependencies": [
        "CONF-01"
      ],
      "assignee": "dev-a",
      "priority": "p1",
      "phase": "Phase 1"
    },
    "CORE-01": {
      "id": "CORE-01",
      "name": "Runner Lifecycle",
      "status": "in_progress",
      "dependencies": [
        "CONF-01",
        "SKILL-01"
      ],
      "assignee": "dev-a",
      "priority": "p0",
      "phase": "Phase 2",
      "started_at": "2026-01-25T12:16:34Z"
    },
    "CORE-02": {
      "id": "CORE-02",
      "name": "Context Chunking",
      "status": "completed",
      "dependencies": [],
      "assignee": null,
      "priority": "p0",
      "phase": "Phase 2",
      "started_at": "2026-01-26T03:09:34Z",
      "completed_at": "2026-01-26T04:09:41Z"
    },
    "CORE-03": {
      "id": "CORE-03",
      "name": "Output Parsing",
      "status": "pending",
      "dependencies": [
        "CORE-01"
      ],
      "assignee": "dev-a",
      "priority": "p1",
      "phase": "Phase 2"
    },
    "SEC-01": {
      "id": "SEC-01",
      "name": "Sandboxing",
      "status": "ready",
      "dependencies": [
        "CORE-01"
      ],
      "assignee": "dev-b",
      "priority": "p0",
      "phase": "Phase 4"
    },
    "SEC-02": {
      "id": "SEC-02",
      "name": "Prompt Injection",
      "status": "pending",
      "dependencies": [
        "CORE-02"
      ],
      "assignee": "dev-b",
      "priority": "p1",
      "phase": "Phase 4"
    },
    "SEC-03": {
      "id": "SEC-03",
      "name": "RBAC",
      "status": "pending",
      "dependencies": [
        "GOV-01",
        "SEC-01"
      ],
      "assignee": "dev-b",
      "priority": "p1",
      "phase": "Phase 4"
    },
    "GOV-01": {
      "id": "GOV-01",
      "name": "Policy As Code",
      "status": "completed",
      "dependencies": [],
      "assignee": null,
      "priority": "p1",
      "phase": "Phase 4",
      "started_at": "2026-01-26T03:06:45Z",
      "completed_at": "2026-01-26T04:09:42Z"
    },
    "GOV-02": {
      "id": "GOV-02",
      "name": "Quality Gates",
      "status": "pending",
      "dependencies": [
        "CORE-02"
      ],
      "assignee": "dev-b",
      "priority": "p1",
      "phase": "Phase 4"
    },
    "PLAT-01": {
      "id": "PLAT-01",
      "name": "Platform Adapter",
      "status": "ready",
      "dependencies": [
        "CORE-01"
      ],
      "assignee": "dev-a",
      "priority": "p0",
      "phase": "Phase 3"
    },
    "PLAT-02": {
      "id": "PLAT-02",
      "name": "Async Execution",
      "status": "pending",
      "dependencies": [
        "PLAT-01"
      ],
      "assignee": "dev-a",
      "priority": "p1",
      "phase": "Phase 3"
    },
    "PLAT-03": {
      "id": "PLAT-03",
      "name": "GitLab Adapter",
      "status": "pending",
      "dependencies": [
        "PLAT-01"
      ],
      "assignee": "dev-a",
      "priority": "p1",
      "phase": "Phase 3"
    },
    "PLAT-04": {
      "id": "PLAT-04",
      "name": "Jenkins Plugin",
      "status": "pending",
      "dependencies": [
        "PLAT-01"
      ],
      "assignee": "dev-a",
      "priority": "p1",
      "phase": "Phase 3"
    },
    "PLAT-05": {
      "id": "PLAT-05",
      "name": "Composite Actions",
      "status": "ready",
      "dependencies": [
        "DIST-01"
      ],
      "assignee": "dev-b",
      "priority": "p1",
      "phase": "Phase 3"
    },
    "PLAT-06": {
      "id": "PLAT-06",
      "name": "Gitee Adapter",
      "status": "pending",
      "dependencies": [
        "PLAT-01"
      ],
      "assignee": "dev-a",
      "priority": "p1",
      "phase": "Phase 3"
    },
    "LIB-01": {
      "id": "LIB-01",
      "name": "Standard Skills",
      "status": "completed",
      "dependencies": [
        "SKILL-01"
      ],
      "assignee": null,
      "priority": "p1",
      "phase": "Phase 5",
      "started_at": "2026-01-26T03:06:46Z",
      "completed_at": "2026-01-26T04:09:42Z"
    },
    "LIB-02": {
      "id": "LIB-02",
      "name": "Extended Skills",
      "status": "ready",
      "dependencies": [
        "SKILL-01",
        "DIST-01"
      ],
      "assignee": "dev-c",
      "priority": "p1",
      "phase": "Phase 5"
    },
    "LIB-03": {
      "id": "LIB-03",
      "name": "Doc Generator",
      "status": "ready",
      "dependencies": [
        "SKILL-01"
      ],
      "assignee": "dev-c",
      "priority": "p1",
      "phase": "Phase 5"
    },
    "LIB-04": {
      "id": "LIB-04",
      "name": "Compliance Check",
      "status": "blocked",
      "dependencies": [
        "SKILL-01",
        "GOV-01"
      ],
      "assignee": "dev-c",
      "priority": "p1",
      "phase": "Phase 5"
    },
    "MCP-01": {
      "id": "MCP-01",
      "name": "Dual Layer Architecture",
      "status": "pending",
      "dependencies": [],
      "assignee": "dev-c",
      "priority": "p2",
      "phase": "Phase 7"
    },
    "MCP-02": {
      "id": "MCP-02",
      "name": "External Integrations",
      "status": "ready",
      "dependencies": [
        "SKILL-01"
      ],
      "assignee": "dev-c",
      "priority": "p1",
      "phase": "Phase 7"
    },
    "ECO-01": {
      "id": "ECO-01",
      "name": "Skill Marketplace",
      "status": "ready",
      "dependencies": [
        "SKILL-01"
      ],
      "assignee": "dev-c",
      "priority": "p2",
      "phase": "Phase 7"
    },
    "RFC-01": {
      "id": "RFC-01",
      "name": "RFC Process",
      "status": "ready",
      "dependencies": [
        "SKILL-01"
      ],
      "assignee": "dev-c",
      "priority": "p2",
      "phase": "Phase 7"
    },
    "PERF-01": {
      "id": "PERF-01",
      "name": "Caching",
      "status": "pending",
      "dependencies": [
        "CONF-02"
      ],
      "assignee": "dev-b",
      "priority": "p1",
      "phase": "Phase 6"
    },
    "OPS-01": {
      "id": "OPS-01",
      "name": "Observability",
      "status": "pending",
      "dependencies": [
        "CONF-02"
      ],
      "assignee": "dev-b",
      "priority": "p1",
      "phase": "Phase 6"
    },
    "STATS-01": {
      "id": "STATS-01",
      "name": "Availability",
      "status": "pending",
      "dependencies": [],
      "assignee": "dev-b",
      "priority": "p2",
      "phase": "Phase 6"
    },
    "HOOKS-01": {
      "id": "HOOKS-01",
      "name": "Integration",
      "status": "ready",
      "dependencies": [
        "CORE-01",
        "SEC-01"
      ],
      "assignee": "dev-a",
      "priority": "p1",
      "phase": "Phase 6"
    }
  },
  "locks": {},
  "worktrees": [],
  "milestones": {
    "M0": {
      "name": "项目启动",
      "status": "completed",
      "completed_at": "2026-01-25T00:00:00Z"
    },
    "M1": {
      "name": "基础就绪",
      "status": "completed",
      "completed_at": "2026-01-25T00:00:00Z"
    },
    "M2": {
      "name": "核心 MVP",
      "status": "pending",
      "completed_at": null
    },
    "M3": {
      "name": "平台集成",
      "status": "pending",
      "completed_at": null
    },
    "M4": {
      "name": "安全合规",
      "status": "pending",
      "completed_at": null
    },
    "M5": {
      "name": "技能完整",
      "status": "pending",
      "completed_at": null
    },
    "M6": {
      "name": "生产就绪",
      "status": "pending",
      "completed_at": null
    },
    "M7": {
      "name": "生态开放",
      "status": "pending",
      "completed_at": null
    }
  }
}
